{
  "schema_version": "1.0.0",
  "plan_id": "plan_ref_003",
  "project_id": "proj_demo_03",
  "brief_spec_version": "1.0.0",
  "status": "READY_FOR_DIRECTOR",
  "transfer_mode": "STANDARD_REFERENCE_TRANSFER",
  "transfer_intensity": {
    "value": "MEDIUM",
    "source": "USER_EXPLICIT",
    "confidence": "HIGH"
  },
  "base_analysis": {
    "base_asset_id": null,
    "semantic_identity": "Vertical mobile app feature banner",
    "protected_elements": ["mandatory brand logo placement top-left"],
    "required_copy": ["Fast Checkout"],
    "subject_identity_requirements": "None",
    "existing_composition_constraints": ["aspect ratio 9:16 vertical"],
    "elements_allowed_to_change": ["background scenery"],
    "elements_forbidden_to_change": ["logo placement"]
  },
  "reference_analyses": [
    {
      "reference_asset_id": "asset_horizontal_ref",
      "role": "PRIMARY_REFERENCE",
      "scope": "COMPOSITION",
      "authority": "USER_PRIMARY_REFERENCE",
      "observations": [
        {
          "observation_id": "obs_conf_01",
          "category": "COMPOSITION",
          "description": "Horizontal banner layout with central focal point and top-right logo placement.",
          "region": "top-right",
          "salience": "HIGH",
          "confidence": "HIGH",
          "provenance": "OBSERVED"
        }
      ],
      "reference_dna": {
        "composition": "Horizontal focal balance with top-right logo"
      },
      "transfer_relevance": "MEDIUM",
      "confidence": "HIGH",
      "provenance": "OBSERVED"
    }
  ],
  "design_decision_map": [
    {
      "mapping_id": "map_conf_01",
      "source_reference_asset_id": "asset_horizontal_ref",
      "observation_ids": ["obs_conf_01"],
      "action": "CONFLICT",
      "target_in_new_composition": "Resolve format clash between reference horizontal layout and vertical 9:16 brief constraint.",
      "rationale": "Reference top-right logo placement conflicts with base brand guideline requiring top-left logo on vertical format.",
      "strength": "HIGH",
      "flexibility": "LOCKED",
      "protected_dependencies": ["mandatory brand logo placement top-left"],
      "confidence": "HIGH",
      "provenance": "OBSERVED"
    }
  ],
  "conflicts": [
    {
      "conflict_id": "conf_01",
      "type": "REFERENCE_VS_FORMAT",
      "description": "Reference expects horizontal layout; brief mandates vertical 9:16 with top-left logo.",
      "severity": "HIGH",
      "blocking": false,
      "involved_assets": ["asset_horizontal_ref"],
      "involved_constraints": ["mandatory brand logo placement top-left", "aspect ratio 9:16 vertical"],
      "translator_position": "Discard reference top-right logo placement and adapt composition to vertical format while maintaining brand top-left logo.",
      "resolution_status": "RESOLVED_BY_ADAPTATION",
      "requires_director_decision": false,
      "requires_user_decision": false,
      "provenance": "OBSERVED"
    }
  ],
  "non_negotiable_anchors": [],
  "flexible_areas": [
    {
      "area": "horizontal flow adapted to vertical stack",
      "freedom_level": "HIGH",
      "rationale": "Vertical format requires stacking elements."
    }
  ],
  "risks": [
    {
      "risk_id": "risk_conf_01",
      "description": "Adapting horizontal reference to vertical might alter focal balance.",
      "severity": "LOW",
      "mitigation": "Creative Director will establish vertical focal hierarchy."
    }
  ],
  "open_questions": [],
  "provenance": {
    "translator_version": "1.0.0",
    "created_at": "2026-08-09T12:00:00Z",
    "notes": "Hypothetical fixture C (Conflicting reference resolved)."
  },
  "confidence": {
    "overall": "HIGH",
    "rationale": "Conflict successfully analyzed and resolved."
  },
  "director_handoff": {
    "what_must_survive": ["mandatory brand logo placement top-left", "Fast Checkout copy"],
    "what_should_survive": ["clean minimalist composition tone from reference"],
    "what_can_change": ["horizontal to vertical layout arrangement"],
    "key_conflicts": ["conf_01 resolved by adaptation"],
    "recommended_anchors": [],
    "creative_opportunities": ["Rebuild horizontal focal flow into vertical cascading hierarchy."],
    "warnings": ["Do not place logo on top-right as seen in reference."]
  }
}
