{
  "schema_version": "1.0.0",
  "plan_id": "rtp-strong-ref-001",
  "project_id": "project-strong-ref-001",
  "brief_spec_version": "1.0.0",
  "status": "READY_FOR_DIRECTOR",
  "transfer_mode": "STANDARD_REFERENCE_TRANSFER",
  "transfer_intensity": {
    "value": "VERY_HIGH",
    "source": "USER_EXPLICIT",
    "confidence": "HIGH"
  },
  "base_analysis": {
    "base_asset_id": "asset-product-001",
    "semantic_identity": "Luxury mechanical wristwatch",
    "protected_elements": [
      "product_dial",
      "product_case"
    ],
    "required_copy": [],
    "subject_identity_requirements": "None",
    "existing_composition_constraints": [
      "square aspect ratio 1:1"
    ],
    "elements_allowed_to_change": [
      "background",
      "surface reflection"
    ],
    "elements_forbidden_to_change": [
      "product proportions"
    ]
  },
  "reference_analyses": [
    {
      "reference_asset_id": "asset-reference-001",
      "role": "PRIMARY_REFERENCE",
      "scope": "GLOBAL_VISUAL_DIRECTION",
      "authority": "USER_PRIMARY_REFERENCE",
      "observations": [
        {
          "observation_id": "obs_01",
          "category": "LIGHTING",
          "description": "High contrast cyan rim light on right edge and magenta rim light on left edge.",
          "region": "edges",
          "salience": "DOMINANT",
          "confidence": "HIGH",
          "provenance": "OBSERVED"
        },
        {
          "observation_id": "obs_02",
          "category": "MATERIAL",
          "description": "Dark matte charcoal textured background surface.",
          "region": "background",
          "salience": "HIGH",
          "confidence": "HIGH",
          "provenance": "OBSERVED"
        }
      ],
      "reference_dna": {
        "lighting": "Dual-color rim lighting (cyan/magenta)",
        "environment": "Matte dark architectural background"
      },
      "transfer_relevance": "HIGH",
      "confidence": "HIGH",
      "provenance": "OBSERVED"
    }
  ],
  "design_decision_map": [
    {
      "mapping_id": "map_01",
      "source_reference_asset_id": "asset-reference-001",
      "observation_ids": [
        "obs_01"
      ],
      "action": "TRANSFER",
      "target_in_new_composition": "Apply cyan and magenta rim lighting to the luxury watch case edges.",
      "rationale": "Creates futuristic premium tension and strong subject separation from dark background.",
      "strength": "HIGH",
      "flexibility": "LOW",
      "protected_dependencies": [
        "product_dial"
      ],
      "confidence": "HIGH",
      "provenance": "OBSERVED"
    },
    {
      "mapping_id": "map_02",
      "source_reference_asset_id": "asset-reference-001",
      "observation_ids": [
        "obs_02"
      ],
      "action": "TRANSFER",
      "target_in_new_composition": "Render product on a dark matte charcoal surface.",
      "rationale": "Maintains unified nocturnal atmosphere and premium aesthetic.",
      "strength": "HIGH",
      "flexibility": "MEDIUM",
      "protected_dependencies": [],
      "confidence": "HIGH",
      "provenance": "OBSERVED"
    }
  ],
  "conflicts": [],
  "non_negotiable_anchors": [
    {
      "anchor_id": "anchor-depth-001",
      "description": "Aggressive layered depth and foreground behavior",
      "source_reference_asset_id": "asset-reference-001",
      "function": "Real depth and environmental integration",
      "importance": "HIGH",
      "flexibility": "LOW",
      "reason": "Core visual DNA requested by user.",
      "provenance": "USER_EXPLICIT"
    },
    {
      "anchor_id": "anchor-light-001",
      "description": "Energetic silhouette separation",
      "source_reference_asset_id": "asset-reference-001",
      "function": "Lighting energy and subject authority",
      "importance": "HIGH",
      "flexibility": "LOW",
      "reason": "Core visual DNA requested by user.",
      "provenance": "USER_EXPLICIT"
    },
    {
      "anchor_id": "anchor-mass-001",
      "description": "Asymmetrical mass tension",
      "source_reference_asset_id": "asset-reference-001",
      "function": "Composition, density and protected copy balance",
      "importance": "HIGH",
      "flexibility": "LOW",
      "reason": "Core visual DNA requested by user.",
      "provenance": "USER_EXPLICIT"
    }
  ],
  "flexible_areas": [
    {
      "area": "exact surface micro-textures",
      "freedom_level": "MEDIUM",
      "rationale": "Surface details can adapt to product scale."
    }
  ],
  "risks": [
    {
      "risk_id": "risk_01",
      "description": "Over-saturation of cyan/magenta lights could obscure metallic reflections.",
      "severity": "MEDIUM",
      "mitigation": "Technical room should balance rim light intensity."
    }
  ],
  "open_questions": [],
  "provenance": {
    "translator_version": "1.0.0",
    "created_at": "2026-08-09T12:00:00Z",
    "notes": "Hypothetical example fixture A."
  },
  "confidence": {
    "overall": "HIGH",
    "rationale": "Clear user instructions and distinct reference observations."
  },
  "director_handoff": {
    "what_must_survive": [
      "identity",
      "semantic campaign idea",
      "layered depth",
      "foreground behavior",
      "lighting energy",
      "density",
      "typography behavior"
    ],
    "what_should_survive": [
      "dark matte charcoal background"
    ],
    "what_can_change": [
      "subtle surface reflections"
    ],
    "key_conflicts": [],
    "recommended_anchors": [
      "anchor-depth-001",
      "anchor-light-001",
      "anchor-mass-001"
    ],
    "creative_opportunities": [
      "Enhance metallic sheen on watch bezel using the dual-color rim light."
    ],
    "warnings": [
      "Transfer functional behaviors; do not reproduce source pixels or exact geometry."
    ]
  }
}
